user	Witam.
system	Witam w twoim prywatnym asystencie kalendarza spotkań.
user	Czy mam obecnie jakieś zaplanowane spotkania?
system	Data: Wtorek 30.03.2021 19:00-20:30\nMiejsce: Restauracja ABC\nSpotkanie z: Jan Kowalski\n--------------------------------\nData: Środa 31.03.2021 12:00-15:30\nMiejsce: Firma ABC\nSpotkanie z: Adam Nowak
user	Chciałbym przesunąć pierwsze spotkanie na za tydzień.
system	Proszę potwierdzić zmianę spotkania:\nData: Wtorek 06.04.2021 19:00-20:30\nMiejsce: Restauracja ABC\nSpotkanie z: Jan Kowalski
user	Potwierdzam
system	Spotkanie zostało zmienione. Czy mogę pomóc w czymś jeszcze?
user	Nie, dziękuję za pomoc - to wszystko : ).